{
  "schema_version": 1,
  "policy": "report-legacy-fail-new-regression",
  "python": {
    "new_module_max_lines": 800,
    "new_function_max_lines": 80,
    "legacy_module_line_caps": {},
    "ci_baseline": {
      "required_in_github_actions": true,
      "env": "KNOWLEDGE_COMPLEXITY_BASE_REF",
      "missing_or_invalid": "fail"
    }
  },
  "commands": {
    "wrapper_baseline": 49,
    "daily_max": 5,
    "readme_daily_max": 7
  },
  "data_growth": {
    "policy": "segment-before-hard-cap",
    "tracked_paths": {
      "registry/items.jsonl": {
        "segment_at_bytes": 4194304,
        "hard_max_bytes": 8388608
      },
      "registry/lifecycle-events.jsonl": {
        "segment_at_bytes": 4194304,
        "hard_max_bytes": 8388608
      },
      "registry/authorizations.jsonl": {
        "segment_at_bytes": 2097152,
        "hard_max_bytes": 4194304
      },
      "registry/automation-runs.jsonl": {
        "segment_at_bytes": 2097152,
        "hard_max_bytes": 4194304
      },
      "registry/durable-evidence-ledger.jsonl": {
        "segment_at_bytes": 2097152,
        "hard_max_bytes": 4194304
      }
    }
  }
}
